{
  "$comment": "Generated by `gwylio schema` from the Pydantic models registered in backend/src/gwylio/infrastructure/config/schemas.py. Do not edit by hand.",
  "$defs": {
    "DateCheckGroup": {
      "additionalProperties": false,
      "description": "Every finding of one kind.",
      "properties": {
        "count": {
          "title": "Count",
          "type": "integer"
        },
        "findings": {
          "items": {
            "$ref": "#/$defs/DateCheckLine"
          },
          "title": "Findings",
          "type": "array"
        },
        "kind": {
          "$ref": "#/$defs/FindingKind"
        },
        "label": {
          "title": "Label",
          "type": "string"
        },
        "meaning": {
          "title": "Meaning",
          "type": "string"
        },
        "severity": {
          "$ref": "#/$defs/Severity"
        }
      },
      "required": [
        "kind",
        "severity",
        "label",
        "meaning",
        "count",
        "findings"
      ],
      "title": "DateCheckGroup",
      "type": "object"
    },
    "DateCheckLine": {
      "additionalProperties": false,
      "description": "One finding in the verification queue.",
      "properties": {
        "detail": {
          "title": "Detail",
          "type": "string"
        },
        "report_id": {
          "title": "Report Id",
          "type": "string"
        },
        "severity": {
          "$ref": "#/$defs/Severity"
        },
        "state": {
          "$ref": "#/$defs/IndicatorState"
        },
        "title": {
          "title": "Title",
          "type": "string"
        }
      },
      "required": [
        "report_id",
        "title",
        "state",
        "detail",
        "severity"
      ],
      "title": "DateCheckLine",
      "type": "object"
    },
    "FindingKind": {
      "description": "What the date check found wrong with a report.",
      "enum": [
        "passed_horizon",
        "future_language",
        "stale_verification",
        "never_verified"
      ],
      "title": "FindingKind",
      "type": "string"
    },
    "IndicatorState": {
      "description": "Where a report is in the indications and warnings lifecycle.",
      "enum": [
        "emerging",
        "tracking",
        "reinforced",
        "matured",
        "faded",
        "parked"
      ],
      "title": "IndicatorState",
      "type": "string"
    },
    "Severity": {
      "description": "How urgent a finding is: ``act`` before the report is quoted again, ``warn`` to check.",
      "enum": [
        "warn",
        "act"
      ],
      "title": "Severity",
      "type": "string"
    }
  },
  "$id": "snapshot-datecheck.schema.json",
  "$schema": "https://json-schema.org/draft/2020-12/schema",
  "additionalProperties": false,
  "description": "datecheck.json, GET /api/v1/datecheck: findings grouped by kind, every kind listed.",
  "properties": {
    "groups": {
      "items": {
        "$ref": "#/$defs/DateCheckGroup"
      },
      "title": "Groups",
      "type": "array"
    },
    "reports_checked": {
      "description": "Reports still in the picture: active or matured.",
      "title": "Reports Checked",
      "type": "integer"
    },
    "reports_flagged": {
      "title": "Reports Flagged",
      "type": "integer"
    },
    "today": {
      "description": "YYYY-MM-DD.",
      "pattern": "^[0-9]{4}-[0-9]{2}-[0-9]{2}$",
      "title": "Today",
      "type": "string"
    },
    "total": {
      "title": "Total",
      "type": "integer"
    }
  },
  "required": [
    "today",
    "reports_checked",
    "total",
    "reports_flagged",
    "groups"
  ],
  "title": "DateCheck",
  "type": "object"
}
