{
  "groups": [
    {
      "count": 0,
      "findings": [],
      "kind": "passed_horizon",
      "label": "Passed event horizons",
      "meaning": "The event horizon has passed and nobody has updated or verified the report since. Check what happened, then rewrite the report in dated past tense.",
      "severity": "act"
    },
    {
      "count": 0,
      "findings": [],
      "kind": "future_language",
      "label": "Future-framed language",
      "meaning": "The title, summary or notes use language that rots once the date passes.",
      "severity": "warn"
    },
    {
      "count": 0,
      "findings": [],
      "kind": "stale_verification",
      "label": "Stale verifications",
      "meaning": "The report was last verified against its source too long ago.",
      "severity": "warn"
    },
    {
      "count": 0,
      "findings": [],
      "kind": "never_verified",
      "label": "Never verified",
      "meaning": "The report has never been verified against its source.",
      "severity": "act"
    }
  ],
  "reports_checked": 95,
  "reports_flagged": 0,
  "today": "2026-10-06",
  "total": 0
}
